state,dun,area_name,ballot_order,name,candidate_uid,party,votes
Terengganu,N.01 Kuala Besut,Kuala Besut,1,Dr. A. Rahman Bin Mokhtar,18343,BN,7123
Terengganu,N.01 Kuala Besut,Kuala Besut,2,Ustaz Haji Nik Zawawi Bin Salleh,18344,PAS,4492
Terengganu,N.02 Kota Putera,Kota Putera,1,Haji Mohd Bin Hj Md Amin,18345,PKR,4758
Terengganu,N.02 Kota Putera,Kota Putera,2,Haji Pehimi Yusof,18346,BN,8090
Terengganu,N.03 Jertih,Jertih,1,Haji Hassan Bin Salleh,18347,PAS,4866
Terengganu,N.03 Jertih,Jertih,2,Dato' Seri Idris Jusoh,18348,BN,7912
Terengganu,N.04 Hulu Besut,Hulu Besut,1,Haji Nawi Bin Mohamad,18349,BN,6740
Terengganu,N.04 Hulu Besut,Hulu Besut,2,Ustaz Mohd Zin Bin Hassan,18350,PAS,4287
Terengganu,N.05 Jabi,Jabi,1,Dr. Azman Bin Ibrahim,18351,PAS,5560
Terengganu,N.05 Jabi,Jabi,2,Ramlan Ali (Cikgu Lan),18352,BN,6364
Terengganu,N.06 Permaisuri,Permaisuri,1,Abd Halim Bin Jusoh,18353,BN,8652
Terengganu,N.06 Permaisuri,Permaisuri,2,Wan Rahim Bin W Hamzah,18354,PKR,5013
Terengganu,N.07 Langkap,Langkap,1,Tengku Ahmad Bin Tengku Hussain,8874,PAS,4131
Terengganu,N.07 Langkap,Langkap,2,Asha'Ari Idris,18356,BN,6682
Terengganu,N.08 Batu Rakit,Batu Rakit,1,Haji Shamshudin Bin Ab. Wahab,18357,PAS,4104
Terengganu,N.08 Batu Rakit,Batu Rakit,2,Ustaz Khazan Che Mat,18358,BN,5590
Terengganu,N.09 Tepuh,Tepuh,1,Ustaz Mohd Ramli Nuh,18359,BN,8455
Terengganu,N.09 Tepuh,Tepuh,2,Ustaz Haji Abu Bakar Bin Abdullah,6314,PAS,8025
Terengganu,N.10 Teluk Pasu,Teluk Pasu,1,Ustaz Ridzuan Bin Haji Hashim,18361,PAS,6817
Terengganu,N.10 Teluk Pasu,Teluk Pasu,2,Datuk Rahin Said,18362,BN,7279
Terengganu,N.11 Seberang Takir,Seberang Takir,1,Ahmad Razif Bin Abd Rahman,18363,BN,6440
Terengganu,N.11 Seberang Takir,Seberang Takir,2,Muzafeq Bin Muhammad,18364,PKR,4010
Terengganu,N.12 Bukit Tunggal,Bukit Tunggal,1,Dr Alias Bin Razak,17035,PAS,5483
Terengganu,N.12 Bukit Tunggal,Bukit Tunggal,2,Tuan Arif Tuan Ahmad,18366,BN,5147
Terengganu,N.13 Wakaf Mempelam,Wakaf Mempelam,1,Othman Bin Awang,7060,BN,7452
Terengganu,N.13 Wakaf Mempelam,Wakaf Mempelam,2,Haji Mohd Abdul Wahid Bin Endut,12236,PAS,9645
Terengganu,N.14 Bandar,Bandar,1,Dr Abdul Manaf Bin Che Mat,18369,PKR,6689
Terengganu,N.14 Bandar,Bandar,2,Toh Chin Yaw,17038,BN,7831
Terengganu,N.15 Ladang,Ladang,1,Dato' Wan Hisham Bin Wan Salleh,18371,BN,6692
Terengganu,N.15 Ladang,Ladang,2,Dato' Tengku Hassan Bin Tengku Omar,18372,PAS,6723
Terengganu,N.16 Batu Buruk,Batu Buruk,1,Nordiana Binti Shafie,18373,BN,9511
Terengganu,N.16 Batu Buruk,Batu Buruk,2,Dr Syed Azman Bin Syed Ahmad Nawawi,18374,PAS,10672
Terengganu,N.17 Alur Limbat,Alur Limbat,1,Dato' Haji Mustafa Ali,18375,PAS,7936
Terengganu,N.17 Alur Limbat,Alur Limbat,2,Alias Bin Abdullah,15726,BN,8735
Terengganu,N.18 Bukit Payung,Bukit Payung,1,Ustaz Mohd Nor Bin Hamzah,18377,PAS,7324
Terengganu,N.18 Bukit Payung,Bukit Payung,2,Zaidi Bin Muda,18378,BN,7209
Terengganu,N.19 Ru Rendang,Ru Rendang,1,Dato' Seri Tuan Guru Haji Abdul Hadi Bin Awang,18379,PAS,9379
Terengganu,N.19 Ru Rendang,Ru Rendang,2,Razali Bin Idris,18380,BN,6693
Terengganu,N.20 Pengkalan Berangan,Pengkalan Berangan,1,Haji Mohd Bin Draman,18381,PAS,7970
Terengganu,N.20 Pengkalan Berangan,Pengkalan Berangan,2,Yahya Bin Khatib Mohamad,3683,BN,8900
Terengganu,N.21 Telemung,Telemung,1,Engku Abu Bakar Bin Engku Mohd,18383,PKR,2726
Terengganu,N.21 Telemung,Telemung,2,Rozi Bin Mamat,17053,BN,8619
Terengganu,N.22 Manir,Manir,1,Ustaz Haji Harun Bin Taib,15736,PAS,5323
Terengganu,N.22 Manir,Manir,2,Haji Wan Sagar,18386,BN,4917
Terengganu,N.23 Kuala Berang,Kuala Berang,1,Haji Muhyidin Bin Haji Abdul Rashid,2651,PAS,4852
Terengganu,N.23 Kuala Berang,Kuala Berang,2,Hj. Mohd Zawawi Ismail,18388,BN,6444
Terengganu,N.24 Ajil,Ajil,1,Ustaz Haji Mohd Razki Bin Alias,18389,PAS,3803
Terengganu,N.24 Ajil,Ajil,2,Dato' Haji Rosol Bin Wahid,18390,BN,8530
Terengganu,N.25 Bukit Besi,Bukit Besi,1,Ustaz Nordin Bin Othman,18391,PAS,3545
Terengganu,N.25 Bukit Besi,Bukit Besi,2,Dato' Haji Din Bin Adam,18392,BN,6037
Terengganu,N.26 Rantau Abang,Rantau Abang,1,Datuk Haji Za'Abar Mohd Adib,18393,BN,7372
Terengganu,N.26 Rantau Abang,Rantau Abang,2,Ustaz Haji Azman Shapawi Bin Abdul Rani,15744,PAS,6582
Terengganu,N.27 Sura,Sura,1,Haji Mohd Rosli Bin Harun,18395,BN,6000
Terengganu,N.27 Sura,Sura,2,Ustaz Wan Hassan Bin Mohd Ramli,15746,PAS,7000
Terengganu,N.28 Paka,Paka,1,Haji Mohd Ariffin,18397,BN,8806
Terengganu,N.28 Paka,Paka,2,Ustaz Haji Saiful Bahri Bin Mamat,15749,PAS,8462
Terengganu,N.29 Kemasik,Kemasik,1,Ustaz Mahadi Bin Nawi,18399,PAS,5357
Terengganu,N.29 Kemasik,Kemasik,2,Rosli Bin Othman,18400,BN,7475
Terengganu,N.30 Kijal,Kijal,1,Dato' Ahmad Bin Said,18401,BN,8169
Terengganu,N.30 Kijal,Kijal,2,Ustaz Hazri Bin Jusoh,18402,PAS,5012
Terengganu,N.31 Cukai,Cukai,1,Haji Hanafiah Bin Mat,17710,PAS,8772
Terengganu,N.31 Cukai,Cukai,2,Dato' Mohamed Bin Awang Tera,17073,BN,9541
Terengganu,N.32 Air Putih,Air Putih,1,Haji Ismail Bin Harun,15757,PAS,6950
Terengganu,N.32 Air Putih,Air Putih,2,Wan Abdul Hakim Bin Wan Mokhtar,18406,BN,10771
